{
  "$schema": "http://json-schema.org/draft-07/schema#",
  "$id": "storybound/codex.schema.json",
  "title": "Storybound Codex entry",
  "description": "data/<namespace>/storybound/codex/<path>.json — an entry made of sections the player uncovers one by one.",
  "type": "object",
  "required": ["title", "sections"],
  "additionalProperties": false,
  "properties": {
    "category": {
      "description": "Group in the Codex tab; a missing namespace means storybound. Name: <ns>.codex.category.<path>. Built in: monsters, animals, characters, places, lore.",
      "$ref": "logic.schema.json#/definitions/id",
      "default": "monsters"
    },
    "entity": {
      "description": "What seen and killed refer to: an id, a #tag or a list. A single id also gives the portrait.",
      "$ref": "logic.schema.json#/definitions/id_list"
    },
    "title": { "$ref": "logic.schema.json#/definitions/story_text" },
    "sections": {
      "type": "array",
      "minItems": 1,
      "items": {
        "type": "object",
        "required": ["id", "unlock"],
        "additionalProperties": false,
        "properties": {
          "id": { "type": "string" },
          "title": { "$ref": "logic.schema.json#/definitions/story_text" },
          "text": {
            "description": "A long text, assets/<ns>/storybound/texts/<lang>/<path>.sbt. Default: <ns>:codex/<entry path>/<section id>.",
            "$ref": "logic.schema.json#/definitions/id"
          },
          "unlock": { "$ref": "#/definitions/unlock" }
        }
      }
    },
    "notify": { "description": "Toasts when the entry appears or a section opens.", "type": "boolean", "default": true },
    "show_kills": { "description": "With an entity: count and show \"Killed: N\" in the Codex. Off for characters and peaceful creatures.", "type": "boolean", "default": true }
  },
  "definitions": {
    "unlock": {
      "description": "Any source reaching count (sightings or kills; a read or a study counts once) opens the section, if the conditions hold then. observed:<seconds>: studied, looked straight at the creature that long.",
      "type": "object",
      "required": ["on"],
      "additionalProperties": false,
      "properties": {
        "on": {
          "type": "array",
          "minItems": 1,
          "items": {
            "type": "string",
            "pattern": "^(seen|killed|manual|observed(:[0-9]+(\\.[0-9]+)?)?|read:([a-z0-9_.-]+:)?[a-z0-9_./-]+)$"
          }
        },
        "count": { "type": "integer", "minimum": 1, "maximum": 100000, "default": 1 },
        "conditions": { "$ref": "logic.schema.json#/definitions/conditions" }
      }
    }
  }
}
